obra,autor_yaml,grupo,termo_encontrado,pagina,posicao_no_texto,contexto_antes,trecho_central,contexto_depois,descartado_por_exclusao
latour_1996_clarifications_en,latour,textil,capillary,1,6318,"recognizing them as having a fibrous, thread-like, wiry, stringy, ropy,",capillary,"character that is never captured by the notions of levels,",0
latour_1996_clarifications_en,latour,textil,fabric,1,6786,understand what holds the society together without reinjecting in its,fabric,the facts manufactured by natural and social sciences and the,0
latour_1996_clarifications_en,latour,textil,fabrics,1,7033,reinjection of the things into our understanding of the social,fabrics,is through a network-like ontology and social theory. To remain,0
latour_1996_clarifications_en,latour,textil,plaiting,1,7295,"purity and unity, but from dissemination, heterogeneity and the careful",plaiting,"of weak ties. This feeling that resistance, obduracy and sturdiness",0
latour_1996_clarifications_en,latour,textil,ties,1,7312,"but from dissemination, heterogeneity and the careful plaiting of weak",ties,"This feeling that resistance, obduracy and sturdiness is more easily",0
latour_1996_clarifications_en,latour,textil,netting,1,7404,"that resistance, obduracy and sturdiness is more easily achieved through",netting,"lacing, weaving, twisting, of ties that are weak by themselves,",0
latour_1996_clarifications_en,latour,textil,lacing,1,7413,"resistance, obduracy and sturdiness is more easily achieved through netting,",lacing,"weaving, twisting, of ties that are weak by themselves, and",0
latour_1996_clarifications_en,latour,textil,weaving,1,7421,"obduracy and sturdiness is more easily achieved through netting, lacing,",weaving,"twisting, of ties that are weak by themselves, and that",0
latour_1996_clarifications_en,latour,textil,twisting,1,7430,"and sturdiness is more easily achieved through netting, lacing, weaving,",twisting,"of ties that are weak by themselves, and that each",0
latour_1996_clarifications_en,latour,textil,ties,1,7443,"is more easily achieved through netting, lacing, weaving, twisting, of",ties,"that are weak by themselves, and that each tie, no",0
latour_1996_clarifications_en,latour,textil,tie,1,7491,"of ties that are weak by themselves, and that each",tie,"no matter how strong, is itself woven out of still",0
latour_1996_clarifications_en,latour,textil,woven,1,7528,"and that each tie, no matter how strong, is itself",woven,"out of still weaker threads, permeates for instance Foucault’s analysis",0
latour_1996_clarifications_en,latour,textil,threads,1,7554,"matter how strong, is itself woven out of still weaker",threads,permeates for instance Foucault’s analysis of micro-powers as well as,0
latour_1996_clarifications_en,latour,textil,filaments,1,8729,in between local pocket of orders or in between the,filaments,relating these contingencies. This is the most counter-intuitive aspect of,0
latour_1996_clarifications_en,latour,textil,nets,1,9232,AT makes use of some of the simplest properties of,nets,and then add to it an actor that does some,0
latour_1996_clarifications_en,latour,textil,fiber,1,10347,lie in the ground close to a cable television glass,fiber,"and nearby a sewage pipe, and each of them will",0
latour_1996_clarifications_en,latour,textil,tied,1,12332,features which have proven devastating for social theory: it is,tied,to an order relation that goes from top to bottom,0
latour_1996_clarifications_en,latour,textil,tied,1,12816,it has no a priori order relation; it is not,tied,to the axiological myth of a top and of a,0
latour_1996_clarifications_en,latour,textil,net,1,31612,"is now indistinguishable from the description, the deployment of the",net,This relativistic position -but one should prefer the less loaded,0
latour_1996_clarifications_en,latour,textil,tied,1,32692,Either the cause designates a body of practices which is,tied,to the network under description -and this is what growth,0
latour_1996_clarifications_en,latour,textil,net,1,36564,in AT. This infralanguage is enough to move from one,net,to the other and the specific explication will always be,0
latour_1996_clarifications_en,latour,textil,net,1,37410,but whether or not one travels or not from a,net,to another. No metalanguage allows you to do this travel.,0
latour_1996_clarifications_en,latour,textil,net,1,39496,tracing activity. As I said above there is not a,net,"and an actor laying down the net, but there is",0
latour_1996_clarifications_en,latour,textil,net,1,39529,is not a net and an actor laying down the,net,but there is an actor whose definition of the world,0
latour_1996_clarifications_en,latour,textil,net,1,39730,or tag a trajectory that is called a network. No,net,"exists independently of the very act of tracing it, and",0
latour_1996_clarifications_en,latour,textil,net,1,39837,no tracing is done by an actor exterior to the,net,A network is not a thing but the recorded movement,0
latour_1996_clarifications_en,latour,textil,net,1,39977,addresses have now changed. It is not longer whether a,net,"is representation or a thing, a part of society or",0
latour_1996_clarifications_en,latour,textil,nets,1,40309,"claims, bodies, energy, etc. since AT also wants to reconstruct",nets,before there is any distinction between what circulates inside and,0
latour_1996_clarifications_en,latour,textil,net,1,41726,gap is no more than a slight bump along the,net,the yawn is an artefact caused by a previous divide,0
latour_1996_clarifications_en,latour,textil,net,1,42169,what other actors do to it. “Society” has the same,net,"properties as the texts, and so has “nature”. But it",0
latour_1996_clarifications_en,latour,textil,nets,1,44225,one is chosen or rejected makes no practical difference since,nets,have no “in between” to be filled in. If chosing,0
latour_1996_clarifications_en,latour,topologia,circulation,1,3058,"is, of exclusively related yet very distant element with the",circulation,between nodes being made compulsory through a set of rigorous,0
latour_1996_clarifications_en,latour,topologia,nodes,1,3078,exclusively related yet very distant element with the circulation between,nodes,being made compulsory through a set of rigorous paths giving,0
latour_1996_clarifications_en,latour,topologia,paths,1,3132,between nodes being made compulsory through a set of rigorous,paths,giving to a few nodes a strategic character. Nothing is,0
latour_1996_clarifications_en,latour,topologia,nodes,1,3154,through a set of rigorous paths giving to a few,nodes,"a strategic character. Nothing is more intensely connected, more distant,",0
latour_1996_clarifications_en,latour,topologia,connected,1,3209,a few nodes a strategic character. Nothing is more intensely,connected,"more distant, more compulsory and more strategically organized than a",0
latour_1996_clarifications_en,latour,topologia,paths,1,3605,"network -it may be local, it may have no compulsory",paths,"no strategically positioned nodes. Tom Hughes’s “networks of power” (198-),",0
latour_1996_clarifications_en,latour,topologia,nodes,1,3640,"local, it may have no compulsory paths, no strategically positioned",nodes,"Tom Hughes’s “networks of power” (198-), to give a historical",0
latour_1996_clarifications_en,latour,topologia,grid,1,3905,"the engineer’s On actor-network theory sense, that is the electrical",grid,Even at this later stage the engineering definition of networks,0
latour_1996_clarifications_en,latour,topologia,proximity,1,4323,"social relations of individual human actors -their frequency, distribution, homogeneity,",proximity,It was devised as a reaction to the often too,0
latour_1996_clarifications_en,latour,topologia,surfaces,1,5863,is a change of methaphors to describe essences: instead of,surfaces,one gets filaments (or rhyzomes in Deleuze’s parlance 197-). More,0
latour_1996_clarifications_en,latour,topologia,topology,1,5966,Deleuze’s parlance 197-). More precisely it is a change of,topology,Instead of thinking in terms of surfaces two dimension- or,0
latour_1996_clarifications_en,latour,topologia,surfaces,1,6008,a change of topology. Instead of thinking in terms of,surfaces,two dimension- or spheres -three dimension- one is asked to,0
latour_1996_clarifications_en,latour,topologia,nodes,1,6095,-three dimension- one is asked to think in terms of,nodes,that have as many dimensions as they have connections. As,0
latour_1996_clarifications_en,latour,topologia,connections,1,6143,of nodes that have as many dimensions as they have,connections,"As a first approximation, the AT claims that modern societies",0
latour_1996_clarifications_en,latour,topologia,topology,1,6560,"by those traditional words without having to buy the ontology,",topology,and politics that goes with them. AT has been developped,0
latour_1996_clarifications_en,latour,topologia,connections,1,8084,"then, at a great price, sometimes end into provisionnaly commensurable",connections,Through this foreground/background reversal AT has some affinity with the,0
latour_1996_clarifications_en,latour,topologia,loci,1,8416,rule but the exceptions that have to be accounted for.,Loci,contingencies or clusters are more like archipelagos on a sea,0
latour_1996_clarifications_en,latour,topologia,surface,1,8591,"Less metaphorically, whereas universalists have to fill in the whole",surface,"either with order or with contingencies, AT do not attempt",0
latour_1996_clarifications_en,latour,topologia,proximity,1,9538,that we get rid of “the tyranny of distance” or,proximity,elements which are close when disconnected may be infinitely remote,0
latour_1996_clarifications_en,latour,topologia,disconnected,1,9579,tyranny of distance” or proximity; elements which are close when,disconnected,"may be infinitely remote if their connections are analyzed; conversely,",0
latour_1996_clarifications_en,latour,topologia,connections,1,9626,are close when disconnected may be infinitely remote if their,connections,"are analyzed; conversely, elements which would appear as infinitely distant",0
latour_1996_clarifications_en,latour,topologia,connections,1,9738,would appear as infinitely distant may be close when their,connections,are brought back into the picture. I can be one,0
latour_1996_clarifications_en,latour,topologia,connected,1,9884,"in the next telephone booth, and be nevertheless more closely",connected,to my mother 6000 miles away; an Alaskan reindeer might,0
latour_1996_clarifications_en,latour,topologia,proximity,1,10177,arab of his age but in spite of this close,proximity,in first grade they might drift apart in worlds that,0
latour_1996_clarifications_en,latour,topologia,proximity,1,10620,prevalence of geograpy. It seems obvious that we can oppose,proximity,"and connections. However, geographical proximity is the result of a",0
latour_1996_clarifications_en,latour,topologia,connections,1,10634,geograpy. It seems obvious that we can oppose proximity and,connections,"However, geographical proximity is the result of a science, geography,",0
latour_1996_clarifications_en,latour,topologia,proximity,1,10669,"obvious that we can oppose proximity and connections. However, geographical",proximity,"is the result of a science, geography, of a profession,",0
latour_1996_clarifications_en,latour,topologia,proximity,1,10825,"of a practice, mapping system, measuring, triangulating. Their definition of",proximity,and distance is useless for AT -or it should be,0
latour_1996_clarifications_en,latour,topologia,connections,1,10907,AT -or it should be included as one type of,connections,one type of networks as we will see below. All,0
latour_1996_clarifications_en,latour,topologia,surface,1,10991,as we will see below. All definitions in terms of,surface,and territories come from our reading of maps drawn and,0
latour_1996_clarifications_en,latour,topologia,proximity,1,11178,"own networks, there is no such a thing as a",proximity,or a distance which would not be defined by connectibility.,0
latour_1996_clarifications_en,latour,topologia,connection,1,11290,be defined by connectibility. The geographical notion is simply another,connection,to a grid defining a metrics and a scale. The,0
latour_1996_clarifications_en,latour,topologia,grid,1,11306,connectibility. The geographical notion is simply another connection to a,grid,defining a metrics and a scale. The notion of network,0
latour_1996_clarifications_en,latour,topologia,scale,1,11336,another connection to a grid defining a metrics and a,scale,The notion of network helps us to lift the tyranny,0
latour_1996_clarifications_en,latour,topologia,connections,1,11555,associations. a is further from b than from e once,connections,are taken into account; the proximity of a and b,0
latour_1996_clarifications_en,latour,topologia,proximity,1,11595,than from e once connections are taken into account; the,proximity,of a and b or of c and d is,0
latour_1996_clarifications_en,latour,topologia,connections,1,11644,b or of c and d is due to the,connections,established by the grid system and the work of geographers;,0
latour_1996_clarifications_en,latour,topologia,grid,1,11675,and d is due to the connections established by the,grid,system and the work of geographers; grid layering and map,0
latour_1996_clarifications_en,latour,topologia,grid,1,11716,established by the grid system and the work of geographers;,grid,layering and map making is another network and not what,0
latour_1996_clarifications_en,latour,topologia,scale,1,11814,network and not what in which networks are situated Small,scale,scale: the notion of network allows us to dissolve the,0
latour_1996_clarifications_en,latour,topologia,scale,1,11826,and not what in which networks are situated Small scale/large,scale,the notion of network allows us to dissolve the micro-,0
latour_1996_clarifications_en,latour,topologia,scales,1,11979,plagued social theory from its inception. The whole metaphor of,scales,"going from the individual, to the nation state, through family,",0
latour_1996_clarifications_en,latour,topologia,connections,1,12119,"kin, groups, institutions etc. is replaced by a metaphor of",connections,"A network is never bigger than another one, it is",0
latour_1996_clarifications_en,latour,topologia,connected,1,12214,"than another one, it is simply longer or more intensely",connected,The small scale/largescale model has three features which have proven,0
latour_1996_clarifications_en,latour,topologia,scale,1,12235,it is simply longer or more intensely connected. The small,scale,model has three features which have proven devastating for social,0
latour_1996_clarifications_en,latour,topologia,scale,1,12499,and a bottom-; it implies that the element “b” being,scale,is of a different nature and should be studied thus,0
latour_1996_clarifications_en,latour,topologia,scale,1,12601,should be studied thus differently from element “a” which is,scale,it is utterly unable to follow how an element goes,0
latour_1996_clarifications_en,latour,topologia,locus,1,12935,of society; it makes absolutely no assumption whether a specific,locus,is macro- or micro- and does not modify the tools,0
latour_1996_clarifications_en,latour,topologia,connected,1,13107,has no difficulty in following the transformation of a poorly,connected,element into a highly connected one and back. A network,0
latour_1996_clarifications_en,latour,topologia,connected,1,13139,the transformation of a poorly connected element into a highly,connected,one and back. A network notion is ideally suited to,0
latour_1996_clarifications_en,latour,topologia,scales,1,13222,network notion is ideally suited to follow the change of,scales,since it does not require the analyst to partition her,0
latour_1996_clarifications_en,latour,topologia,scale,1,13306,require the analyst to partition her world with any priori,scale,"The scale, that is, the type, number and topography of",0
latour_1996_clarifications_en,latour,topologia,scale,1,13317,analyst to partition her world with any priori scale. The,scale,"that is, the type, number and topography of connections is",0
latour_1996_clarifications_en,latour,topologia,connections,1,13368,"The scale, that is, the type, number and topography of",connections,is left to the actors themselves. The notion of network,0
latour_1996_clarifications_en,latour,topologia,scale,1,13621,"society -its vertical space, its hierarchy, its layering, its macro",scale,"its wholeness, its overarching character- and how these features are",0
latour_1996_clarifications_en,latour,topologia,connected,1,13876,allows us to think of a global entity -a highly,connected,one- which remains nevertheless continuously local... Instead of opposing the,0
latour_1996_clarifications_en,latour,topologia,connections,1,14103,how a given element becomes strategic through the number of,connections,it commands and how does it lose its importance when,0
latour_1996_clarifications_en,latour,topologia,connections,1,14179,and how does it lose its importance when losing its,connections,Inside/outside: the notion of network allows us to get rid,0
latour_1996_clarifications_en,latour,topologia,inside,1,14192,how does it lose its importance when losing its connections.,Inside,the notion of network allows us to get rid of,0
latour_1996_clarifications_en,latour,topologia,outside,1,14199,how does it lose its importance when losing its connections.,outside,the notion of network allows us to get rid of,0
latour_1996_clarifications_en,latour,topologia,surface,1,14322,third spatial dimension after those of far/close and big/small. A,surface,has an inside and an outside separated by a boundary.,0
latour_1996_clarifications_en,latour,topologia,inside,1,14337,after those of far/close and big/small. A surface has an,inside,and an outside separated by a boundary. A network is,0
latour_1996_clarifications_en,latour,topologia,outside,1,14351,far/close and big/small. A surface has an inside and an,outside,separated by a boundary. A network is all boundary without,0
latour_1996_clarifications_en,latour,topologia,boundary,1,14374,surface has an inside and an outside separated by a,boundary,A network is all boundary without inside and outside. The,0
latour_1996_clarifications_en,latour,topologia,boundary,1,14401,an outside separated by a boundary. A network is all,boundary,without inside and outside. The only question one may ask,0
latour_1996_clarifications_en,latour,topologia,inside,1,14418,separated by a boundary. A network is all boundary without,inside,and outside. The only question one may ask is whether,0
latour_1996_clarifications_en,latour,topologia,outside,1,14429,a boundary. A network is all boundary without inside and,outside,The only question one may ask is whether or not,0
latour_1996_clarifications_en,latour,topologia,connection,1,14488,only question one may ask is whether or not a,connection,is established between two elements. The surface “in between” networks,0
latour_1996_clarifications_en,latour,topologia,surface,1,14540,or not a connection is established between two elements. The,surface,“in between” networks is either connected -but then the network,0
latour_1996_clarifications_en,latour,topologia,connected,1,14581,between two elements. The surface “in between” networks is either,connected,"-but then the network is expanding- or non existing. Literally,",0
latour_1996_clarifications_en,latour,topologia,outside,1,14672,"is expanding- or non existing. Literally, a network has no",outside,"It is not a foreground over a background, nor a",0
latour_1996_clarifications_en,latour,topologia,connections,1,15003,longer obliged to fill in the space in between the,connections,-to use a computer metaphor we do not need the,0
latour_1996_clarifications_en,latour,topologia,topological,1,15270,"has no shadow. The notion of network, in its barest",topological,"outline, allows us already to reshuffle spatial metaphors that have",0
latour_1996_clarifications_en,latour,topologia,inside,1,15447,"difficult: close and far, up and down, local and global,",inside,and outside. They are replaced by associations and connections (which,0
latour_1996_clarifications_en,latour,topologia,outside,1,15458,"and far, up and down, local and global, inside and",outside,They are replaced by associations and connections (which AT does,0
latour_1996_clarifications_en,latour,topologia,connections,1,15505,"global, inside and outside. They are replaced by associations and",connections,(which AT does not have to qualify as being either,0
latour_1996_clarifications_en,latour,topologia,outside,1,15690,"to say that there is nothing like “macro” society, or",outside,"nature as the AT is often accused to, but that",0
latour_1996_clarifications_en,latour,topologia,proximity,1,15790,"but that in order to obtain the effects of distance,",proximity,"hierarchies, connectedness, outsiderness and surfaces, an enormous supplementary work has",0
latour_1996_clarifications_en,latour,topologia,surfaces,1,15846,"obtain the effects of distance, proximity, hierarchies, connectedness, outsiderness and",surfaces,an enormous supplementary work has to be done. This work,0
latour_1996_clarifications_en,latour,topologia,topological,1,15944,be done. This work however is not captured by the,topological,notion of network no matter how sophisticated we wish to,0
latour_1996_clarifications_en,latour,topologia,topological,1,16316,these properties we should now move on from static and,topological,properties to dynamic and ontological ones. . . . A,0
latour_1996_clarifications_en,latour,topologia,connections,1,18866,"inhuman, characteristics; the distribution of properties among these entities; the",connections,"established between them; the circulation entailed by these attributions, distributions",0
latour_1996_clarifications_en,latour,topologia,circulation,1,18908,properties among these entities; the connections established between them; the,circulation,"entailed by these attributions, distributions and connections; the transformation of",0
latour_1996_clarifications_en,latour,topologia,connections,1,18970,"between them; the circulation entailed by these attributions, distributions and",connections,"the transformation of those attributions, distributions and connections, of the",0
latour_1996_clarifications_en,latour,topologia,connections,1,19043,"distributions and connections; the transformation of those attributions, distributions and",connections,of the many elements that circulates and of the few,0
latour_1996_clarifications_en,latour,topologia,path,1,21037,from abstract structure -actants- to concrete ones actors. The generative,path,that is thus retraced gives an extraordinary liberty of analysis,0
latour_1996_clarifications_en,latour,topologia,flows,1,21816,"Second, actors are not conceived as fixed entities but as",flows,"as circulating objects, undergoing trials, and their stability, continuity, isotopies",0
latour_1996_clarifications_en,latour,topologia,circulating,1,21826,"are not conceived as fixed entities but as flows, as",circulating,"objects, undergoing trials, and their stability, continuity, isotopies has to",0
latour_1996_clarifications_en,latour,topologia,path,1,24010,associations like semiotics is a method to describe the generative,path,of any narration. It does not say anything about the,0
latour_1996_clarifications_en,latour,topologia,scale,1,24458,"heterogeneous, that they are free associationists, know no differences of",scale,"that there is no inertia, no order, that they build",0
latour_1996_clarifications_en,latour,topologia,path,1,27875,meaning bit from semiotics... If one now translates semiotics by,path,"or order-making, or creation of directions, one does not have",0
latour_1996_clarifications_en,latour,topologia,circulating,1,28439,"status give to all entities both the action, variety and",circulating,existence recognized in the study of textual characters and also,0
latour_1996_clarifications_en,latour,topologia,connections,1,29286,another. No explanation is stronger or more powerful than providing,connections,"among unrelated elements, or showing how one element holds many",0
latour_1996_clarifications_en,latour,topologia,outside,1,30061,can be detached from its growth. One does not jump,outside,"a network to add an explanation -a cause, a factor,",0
latour_1996_clarifications_en,latour,topologia,outside,1,34609,This “problem” falls however when the epistemological myth of an,outside,observer providing an explanation in addition to “mere description” disappears.,0
latour_1996_clarifications_en,latour,topologia,path,1,35740,"Reflexivity is not a “problem”, a stumbling block along the",path,"to knowledge, the prison in which all enterprises would be",0
latour_1996_clarifications_en,latour,topologia,loci,1,36126,rich metalanguage were usally small points limited to very specific,loci,"-campuses, studios, corporate rooms. The price AT pays to move",0
latour_1996_clarifications_en,latour,topologia,locus,1,36203,corporate rooms. The price AT pays to move from one,locus,to the next is that there are as many metalanguages,0
latour_1996_clarifications_en,latour,topologia,topological,1,39203,metalanguages as possible. . . . Now that the basic,topological,properties of networks have been sketched -second section- and that,0
latour_1996_clarifications_en,latour,topologia,trajectory,1,39690,"shadow forth, inscroll, file, list, record, mark, or tag a",trajectory,that is called a network. No net exists independently of,0
latour_1996_clarifications_en,latour,topologia,inside,1,40153,this movement is recorded. We cannot say that what moves,inside,"networks are informations, genes, cars, bytes, salutations, words, forces, opinions,",0
