obra,autor_yaml,grupo,termo_encontrado,pagina,posicao_no_texto,contexto_antes,trecho_central,contexto_depois,descartado_por_exclusao
latour_1996_clarifications_en,latour,topologia,inside,1,40370,reconstruct nets before there is any distinction between what circulates,inside,"and what keep them on track, so to speak, from",0
latour_1996_clarifications_en,latour,topologia,outside,1,40428,"what keep them on track, so to speak, from the",outside,"Again, as I said at the beginning, the technical metaphor",0
latour_1996_clarifications_en,latour,topologia,circulating,1,40619,"activity. No, what circulates has to be defined like the",circulating,"object in semiotics of texts -especially scientific texts (Bastide, 199-).",0
latour_1996_clarifications_en,latour,topologia,circulating,1,40925,"the sanctions it receives, the background in which it is",circulating,etc. Its isotopy -that is its persistence in time and,0
latour_1996_clarifications_en,latour,topologia,paths,1,41119,the decisions taken through the narrative programs and the narrative,paths,"However, such a classic definition would limit AT to the",0
latour_1996_clarifications_en,latour,topologia,circulating,1,41233,the world of text and discourse. What happens when a,circulating,object leaves the boundary of a text? The traditionnal answer,0
latour_1996_clarifications_en,latour,topologia,boundary,1,41263,and discourse. What happens when a circulating object leaves the,boundary,of a text? The traditionnal answer is that there is,0
latour_1996_clarifications_en,latour,topologia,circulating,1,41461,dramatic trial is supposed to abruptly intervene through which the,circulating,object is assessed either by checking its referential fit or,0
latour_1996_clarifications_en,latour,topologia,circulating,1,41905,"the contrary a continuity, a multiplicity of plugs, between the",circulating,"objects in the text, the claims outside the text in",0
latour_1996_clarifications_en,latour,topologia,outside,1,41949,"plugs, between the circulating objects in the text, the claims",outside,"the text in the “social”, and what the actants themselves",0
latour_1996_clarifications_en,latour,topologia,circulating,1,42042,and what the actants themselves really do in “nature”. The,circulating,object goes on circulating and goes on getting its isotopy,0
latour_1996_clarifications_en,latour,topologia,circulating,1,42069,themselves really do in “nature”. The circulating object goes on,circulating,and goes on getting its isotopy from what other actors,0
latour_1996_clarifications_en,latour,topologia,paths,1,42504,"trials, and events, and ressources that are used along the",paths,to attribute “textuality” or “sociality” or “naturality” to this or,0
latour_1996_clarifications_en,latour,topologia,path,1,42775,common movement. To say that it is a generalized narrative,path,would immediately mean that texts are extended to everything; to,0
latour_1996_clarifications_en,latour,topologia,circulation,1,44491,of the term that what circulates and what makes the,circulation,be both co-determined and transformed. A ball going from hands,0
latour_1996_clarifications_en,latour,topologia,path,1,46004,"ideo-morphic, that is “(x)-morphic”. It might happen that a generative",path,"has limited actants to a homogeneous repertoire of humans, or",0
latour_1996_clarifications_en,latour,topologia,circulating,1,46240,"which should be accounted for. (Actually, even the distinction between",circulating,"object and movers or senders is negotiable, see Latour, 199-)",0
