obra,autor_yaml,grupo,termo_encontrado,pagina,posicao_no_texto,contexto_antes,trecho_central,contexto_depois,descartado_por_exclusao
latour_1999_pandora_en,latour,translation,translation,322,754622,"of the sciences; like ""inscription* "" or ""articulation* , """,translation,is a term that crisscrosses the modernist settle ment*. In,0
latour_1999_pandora_en,latour,translation,translation,322,754923,"of a rigid opposition between context* and content*, chains of",translation,"refer to the work through which actors modify, displace, and",0
latour_1999_pandora_en,latour,translation,translate,322,754996,"refer to the work through which actors modify, displace, and",translate,their various and contradictory interests. TRIALS : In their emerging,0
latour_1999_pandora_en,latour,translation,translation,323,756305,What Is Problematic and What Is Not: The Sociologies of,Translation,"In K. D. Knorr, R. Krohn, and R. Whitley, The",0
latour_1999_pandora_en,latour,translation,translations,326,764491,"Press. Star, S. L., and J. Griesemer. 1989. ""Institutional Ecology,",Translations,and Boundary Objects : Amateurs and Professionals in Berkeley's Mu,0
latour_1999_pandora_en,latour,translation,translation,329,771324,"12-13, 15, 17, 21-22 Counter-Copernican revolutions, 16, 305 Chains of",translation,"27, 69-74, 79, 91 -92, Critics, modern, 276-280 298, 313",0
latour_1999_pandora_en,latour,translation,translation,330,775824,"See Relative existence Glickman, Steve, 255 Experimental protocols, 46-47 Goal",translation,"178-180 Experiments, 20, 124-127, 129-132, 135, God, i, 4-5, 14,",0
latour_1999_pandora_en,latour,translation,translation,333,784666,", 311 ; standardized, 59Political ecology, 202-203 6 1 ;",translation,"of, 70-71 Politics, 13-14, 21, 140, 214, 219, 227, 280,",1
latour_1999_pandora_en,latour,translation,translations,334,790812,"Ego, 6, 72, 125 Sociotechnology, 198, 203-204, 214 Transformations. See",Translations,"Socrates, 11-12, 14-20, 22, 216-265 , 268 Translation model, 91-92,",0
latour_1999_pandora_en,latour,translation,translation,334,790874,"Transformations. See Translations Socrates, 11-12, 14-20, 22, 216-265 , 268",Translation,"model, 91-92, 249 Soil studies. See Pedology Translations, 53, 58,",0
latour_1999_pandora_en,latour,translation,translations,334,790953,", 268 Translation model, 91-92, 249 Soil studies. See Pedology",Translations,"53, 58, 61, 64-65, 68, 110, Sophists, 21, 216-219, 221,",0
latour_1999_pandora_en,latour,factish,factishes,8,5466,"Cosmopolitic 9. The Slight Surprise of Action 266 Facts, Fetishes,",Factishes,Conclusion 293 What Contrivance Will Free Pandora 's Hope? C,0
latour_1999_pandora_en,latour,factish,factish,27,46031,I attempt to provide one here with the notion of,factish,"As we see in Chapter 9, ""factish"" is a combination",0
latour_1999_pandora_en,latour,factish,factish,27,46066,"the notion of ""factish."" As we see in Chapter 9,",factish,"is a combination of the words ""fact"" and ""fetish,"" in",0
latour_1999_pandora_en,latour,factish,factish,125,259984,of playground for human ingenuity (in the discussion of the,factish,"in Chapter 9 I will seek to counteract this). Third,",0
latour_1999_pandora_en,latour,factish,factish,147,316202,"until later, when I will introduce the strange concept of",factish,*. Can we do better and escape from art and,0
latour_1999_pandora_en,latour,factish,factishes,198,441596,in Chapter 9 that this is because they are all,factishes,"In the meantime I want to propose yet another term,",0
latour_1999_pandora_en,latour,factish,factish,274,635617,the Body Politic with its own flesh and blood. The,factish,"*, once smashed, can be patched up but never made",0
latour_1999_pandora_en,latour,factish,factishes,277,643580,"demonstration and democracy? The Slight Surprise of Action Facts, Fetishes,",Factishes,What a surprise ! I seem to have accomplished my,0
latour_1999_pandora_en,latour,factish,factishes,285,664373,are reality to be make us act autonomous autonomous rightly,FACTISHES,Figure 9 .2 Once the fabrication is seen as the,0
latour_1999_pandora_en,latour,factish,factish,285,665051,what I call the factisb *. We can retrieve the,factish,from the massacre of facts and fetishes when we explicitly,0
latour_1999_pandora_en,latour,factish,factishes,285,665886,"ar guments and actions are everywherefadlitated, pennitted, and afforded by",factishes,The notion of factish is not an analytical category that,0
latour_1999_pandora_en,latour,factish,factish,285,665913,"are everywherefadlitated, pennitted, and afforded by factishes. The notion of",factish,is not an analytical category that can be added to,0
latour_1999_pandora_en,latour,factish,factish,286,667316,"with its polar op posite, postmodernism. The solution of the",factish,"is not to ignore the choice, as many postmoderns do,",0
latour_1999_pandora_en,latour,factish,factish,286,667588,"naive, nowa days, as to dispute such trivia? "" The",factish,suggests an entirely different move : it is because it,0
latour_1999_pandora_en,latour,factish,factish,286,667937,"and ""autonomous real ity"" are synonyms, we will misconstrue the",factish,as yet another form of social constructivism rather than seeing,0
latour_1999_pandora_en,latour,factish,factish,287,670225,"wisdom, which, to be sure, is not that of the",factish,"but is a wisdom all the same, no matter how",0
latour_1999_pandora_en,latour,factish,factishes,288,671499,We see now that the iconoclast is not free from,factishes,because he cannot escape the human agency that manufactures facts,0
latour_1999_pandora_en,latour,factish,factishes,288,671822,are like everyone else : everyone everywhere has need of,factishes,to act and to argue. There is only one nonmodern,0
latour_1999_pandora_en,latour,factish,factishes,288,672087,of resources at once : on the one hand the,factishes,"like everyone else, and on the other the apparently contra",0
latour_1999_pandora_en,latour,factish,factishes,288,672792,and violence and power that allows them to break the,factishes,and to produce two ir reconcilable enemies : fetishes and,0
latour_1999_pandora_en,latour,factish,factishes,288,673429,"the insulated wombs of their ""laborato ries, "" as many",factishes,as they want. To them even the sky is not,0
latour_1999_pandora_en,latour,factish,factishes,289,674716,anew from top to bottom. Notice the construction that makes,factishes,"thrice invisible : above, thE:y have disappeared, replaced by a",0
latour_1999_pandora_en,latour,factish,factishes,289,674924,"constant distinction be tween fact and fiction ; below, the",factishes,"are there-how could they not be?-but they are hidden, invisible,",0
latour_1999_pandora_en,latour,factish,factishes,289,675446,the setup separate from the bottom part. Of course the,factishes,"of the modem exist, but their construction is so strange",0
latour_1999_pandora_en,latour,factish,factishes,289,676154,"to be free from belief, in the furn hands of",factishes,"I, for one, would be forced to become the iconoclast",0
latour_1999_pandora_en,latour,factish,factishes,291,680857,would lead if we lived un der the protection of,factishes,again-no longer caught between facts and fetishes. At least three,0
latour_1999_pandora_en,latour,factish,factishes,291,681294,"is it that iconoclasm breaks, and what is it that",factishes,allow us to restore? A certain theory of action and,0
latour_1999_pandora_en,latour,factish,factish,292,682707,by a hammer that has broken the simple and straightforward,factish,into two parts. The shock of critical intelli gence has,0
latour_1999_pandora_en,latour,factish,factishes,294,688733,with that sort of God or that sort of Man.,Factishes,"bring with them a quite different definition of God, of",0
latour_1999_pandora_en,latour,factish,factishes,295,690333,"lf, as common sense would have it, there are no",factishes,"but only fetishes, which are nothing but pieces of wood",0
latour_1999_pandora_en,latour,factish,factishes,295,690944,"beyond capacity, thanks to the other, simultaneous move that transformed",factishes,into facts. If no human agency is at work-or has,0
latour_1999_pandora_en,latour,factish,factish,295,691734,: these are merely the consequences of having split the,factish,"in two-that which is fabricated, that which is not fabricated.",0
latour_1999_pandora_en,latour,factish,factishes,295,692166,the destruction of the means of argumentation and action that,factishes,"enabled, with the removal of human agency from the THE",0
latour_1999_pandora_en,latour,factish,factish,297,695534,"it is invisible. In practice, however, the stone is a",factish,"and does not claim to be a spirit, to be",0
latour_1999_pandora_en,latour,factish,factishes,298,698256,destructive weapons against beliefs. But if we now speak of,factishes,there exi s t neither beliefs (to be fostered or,0
latour_1999_pandora_en,latour,factish,factishes,299,700601,"com pletely different definition of action, in the hands of",factishes,of to tally different shapes and functions. Care and Caution,0
latour_1999_pandora_en,latour,factish,factish,299,700714,different shapes and functions. Care and Caution What did the,factish,do before it was broken by the anti-fetishist's blow? To,0
latour_1999_pandora_en,latour,factish,factishes,299,701513,the first and as real as the second. What the,factishes,were good at was articulating caution and public ity. They,0
latour_1999_pandora_en,latour,factish,factishes,299,701724,"they tried to break the fetishes, the iconoclasts broke the",factishes,"instead. As I have said, these rampages are what have",0
latour_1999_pandora_en,latour,factish,factish,299,701945,"by any constraints, any responsibility. The broken halves of the",factish,"nailed above the threshold of the mod ernist temple, protect",0
latour_1999_pandora_en,latour,factish,factishes,299,702617,"hairy, networky, rhizomelike. The reason one should always beware of",factishes,"is that their conse quences are unforeseen, the moral order",0
latour_1999_pandora_en,latour,factish,factish,300,703381,"taboo, but that they were afraid he would break the",factish,that kept care and caution under at tentive public consideration,0
latour_1999_pandora_en,latour,factish,factishes,301,708074,one that entertains as many practical ontologies as there are,factishes,"The role of the intellectual is not, then, to grab",0
latour_1999_pandora_en,latour,factish,factishes,302,708396,"in the cartoonish attempts of social constructivists), but to be",factishes,"maybe also a bit facetious-themselves, that is, to protect the",0
latour_1999_pandora_en,latour,factish,factish,302,710320,"but close at hand, in the move ment of the",factish,In the Tel Aviv Diaspora Museum one can see a,0
latour_1999_pandora_en,latour,factish,factishes,303,711250,people will we become when we also abstain from destroying,factishes,"Jagannath was left pondering: ""When they touched it, we lost",0
latour_1999_pandora_en,latour,factish,factishes,305,715773,from drifting into in humanity. But the protective shield of,factishes,"has disappeared, and the Body Politic has been rendered impotent.",0
latour_1999_pandora_en,latour,factish,factishes,306,718101,"pass, they would have needed a little help from their",factishes,but these facilitators have all been broken in two by,0
latour_1999_pandora_en,latour,factish,factishes,310,728397,and thoughtful peace was needed to re assemble the broken,factishes,and to reinvent a politics of united hu mans and,0
latour_1999_pandora_en,latour,factish,factish,317,740398,that are the circum stances of that experiment (see concrescence).,FACTISH,FETISHISM: Fetishism is an accusation made by a denunciator; it,0
latour_1999_pandora_en,latour,factish,factishes,317,740580,projected onto a meaningless object their own beliefs and desires.,Factishes,"in contrast, are types of action that do not fall",0
latour_1999_pandora_en,latour,factish,factish,317,741054,to do away with the notion of belief*. FETISHISM: See,factish,HISTORICITY: A term borrowed from the philosophy of history to,0
latour_1999_pandora_en,latour,factish,factishes,330,772620,"3 ; of humans and INDEX 319 Demarcation/differentiation, 141, 157-158,",Factishes,"16, 136, 18'], 263, 274-278, 280- 164, 166, 306 281,",0
latour_1999_pandora_en,latour,circulating_reference,circulating reference,8,4658,"Reality?"" 1 Newsfrom the Trenches of the Science Wars 2.",Circulating Reference,24 Sampling the Soil in the Amazon Forest 3. Science's,0
latour_1999_pandora_en,latour,circulating_reference,circulating reference,35,65143,C H A P T E R T W 0,Circulating Reference,Sampling the Soil in the Amazon Forest The only way,0
latour_1999_pandora_en,latour,circulating_reference,circulating reference,64,117194,"by superposing pictures and text, a phenomenon, that of the",circulating reference,"that was until now invisible, purposely mud dled by epistemologists,",0
latour_1999_pandora_en,latour,circulating_reference,circulating reference,83,157970,the categorizing work made by the active Ego ; with,circulating reference,phenomena are what routinely circu lates through the cascade of,0
latour_1999_pandora_en,latour,circulating_reference,circulating reference,84,159548,R E F E R E N C E 73,Circulating reference,Mediations from matter to form = 7 I I? I,0
latour_1999_pandora_en,latour,circulating_reference,circulating reference,84,160497,"bridge of correspondence, one has simply to con sider the",circulating reference,and to eliminate all mediations as being unneces sary intermediaries,0
latour_1999_pandora_en,latour,circulating_reference,circulating references,98,190611,coming from the side of the sciences and following the,circulating references,with the system of guidance and alignment that gives them,0
latour_1999_pandora_en,latour,circulating_reference,circulating reference,103,204740,"second, especially with the help of what we learned about",circulating reference,"in Chapter 2 . Scientists not only blur, in their",0
latour_1999_pandora_en,latour,circulating_reference,circulating references,108,216334,"convention, mediations, connections, but from the safety provided by the",circulating references,"that cascade through a great number of transformations and translations,",0
latour_1999_pandora_en,latour,circulating_reference,circulating reference,133,280432,"then aligned with one another, according to the notion of",circulating reference,"with which we are now familiar. First, in the story",0
latour_1999_pandora_en,latour,circulating_reference,circulating reference,148,319873,positively-and is well in keeping with the no tion of,circulating reference,a continuous circuit that should :Q.ever be interrupted if the,0
latour_1999_pandora_en,latour,circulating_reference,circulating reference,161,349861,"type of historicity alto gether. Fortunately, with the notion of",circulating reference,there is noth ing simpler than slackening the tension between,0
latour_1999_pandora_en,latour,circulating_reference,circulating reference,166,363413,"This is another extension, this time into history, of the",circulating reference,we began to follow in Chapter 2. For scientists there,0
latour_1999_pandora_en,latour,circulating_reference,circulating reference,259,597182,"to redescribe it in a cas cade of re-representations, or",circulating reference,whose precise na ture has been as difficult to grasp,0
latour_1999_pandora_en,latour,circulating_reference,circulating reference,308,721780,", vinced, seem odd a few years from now, once",circulating reference,"has been provided to every household, like gas, water, and",0
latour_1999_pandora_en,latour,circulating_reference,circulating reference,315,735314,often placed in the mind. CHAIN OF TRANSLATION: See translation.,CIRCULATING REFERENCE,"See reference. COLLECTIVE: Unlike society*, which is an artifact imposed",0
latour_1999_pandora_en,latour,circulating_reference,circulating reference,318,742141,task. When immutable mobiles are cleverly aligned they produce the,circulating reference,INSTITUTION: Science studies has devoted much attention to the institu,0
latour_1999_pandora_en,latour,circulating_reference,circulating reference,329,771802,"131, 133, 144, 15 0-151, 162-163 Daedalia, 175-176, 178, 181",Circulating reference,"24, 53, 71-74, So, Daedalus. 171, 175-176, 183, 190-191, 196,",0
latour_1999_pandora_en,latour,articulation,articulations,34,63655,"IN REALITY? 23 facts with their beautiful roots, their delicate",articulations,"their many tendrils, and their fragile networks remain, for the",0
latour_1999_pandora_en,latour,articulation,articulation,144,308135,their work. In Search of a Figure of Speech :,Articulation,and Proposition Is it possible to use these categories and,0
latour_1999_pandora_en,latour,articulation,articulation,151,326678,thing sitting there and access to things undergoing no event,Articulation,Stresses the independence of Is not registered in a the,0
latour_1999_pandora_en,latour,articulation,articulated,153,331457,relation than correspondence ; the question becomes whether propositions are,articulated,"with one another or not. it corresponds, a radical doubt",0
latour_1999_pandora_en,latour,articulation,articulation,153,331726,"correspondence across a yawning gap, but what I will call",articulation,"*. For example, Pasteur ""articulates"" the lac tic acid ferment",0
latour_1999_pandora_en,latour,articulation,articulation,153,332141,"entities can participate. Although the word is used in linguistics,",articulation,is in no way limited to language and may be,0
latour_1999_pandora_en,latour,articulation,articulate,154,333634,But they are excellent things if the aim is to,articulate,ever more precisely the two propositions of the lactic acid,0
latour_1999_pandora_en,latour,articulation,articulation,154,334001,"can hope at best for sterile repetition (A is A),",articulation,"relies on predication* with other enti ties (A is B,",0
latour_1999_pandora_en,latour,articulation,articulate,155,335413,"biochemistry be comes, in every sense of the term, ""more",articulate,"so do the biochemists. Actually, thanks to Pasteur's ferment, they",0
latour_1999_pandora_en,latour,articulation,articulate,155,335819,"ferment be comes, since it is now that much more",articulate,"thanks to the arti ficial setting of the laboratory, a",0
latour_1999_pandora_en,latour,articulation,articulated,155,336007,ferment now exists as a discrete entity because it is,articulated,"between so many others, in so many active and artificial",0
latour_1999_pandora_en,latour,articulation,articulated,155,336802,"allowed to say new, original things when we en ter",articulated,settings like good laboratories. Articulation be tween propositions goes much,0
latour_1999_pandora_en,latour,articulation,articulation,155,336847,things when we en ter well-articulated settings like good laboratories.,Articulation,be tween propositions goes much deeper than speech. We speak,0
latour_1999_pandora_en,latour,articulation,articulated,155,336974,We speak because the propositions of the world are themselves,articulated,"not the other way around. More exactly, we are allowed",0
latour_1999_pandora_en,latour,articulation,articulated,155,337135,we allow to speak interestingly (Despret 1996). The notion of,articulated,propositions establishes between knower and known entirely different relations from,0
latour_1999_pandora_en,latour,articulation,articulate,156,337889,"of his flasks and turned it into the splendid, well-defined,",articulate,yeast twirling magnificently across the ballro om of the Academy.,0
latour_1999_pandora_en,latour,articulation,articulation,157,340604,question of historicity by using the notions of proposition and,articulation,that I so abstractly defined at the end of the,0
latour_1999_pandora_en,latour,articulation,articulation,158,341872,"correspondence on the one hand; humans, nonhumans, difference, proposition, and",articulation,on the other. What transformations will the notion of history,0
latour_1999_pandora_en,latour,articulation,articulation,158,342127,group of concepts to the other? Before the notion of,articulation,"it was impossible to answer no to the question ""Did",0
latour_1999_pandora_en,latour,articulation,articulated,160,347611,"falsity, and at less cost, with the distinction be tween",articulated,"and inarticulate propositions. In any case, the sentence ""The ferments",0
latour_1999_pandora_en,latour,articulation,articulated,160,347888,of the subject-object dichotomy or loaded into the series of,articulated,humans and nonhumans. We have now reached the crux of,0
latour_1999_pandora_en,latour,articulation,articulate,161,351406,propositions. The two sentences do not repeat each other. They,articulate,"something different. But the thing itself, where is the thing?",0
latour_1999_pandora_en,latour,articulation,articulated,162,353962,became chemical agents that could even be made through synthesis.,Articulated,"differently they be came different, and yet they were still",0
latour_1999_pandora_en,latour,articulation,articulated,164,359853,vividly with the dualist model or with the model of,articulated,propositions? Which of these two accounts fares best in our,0
latour_1999_pandora_en,latour,articulation,articulations,169,371401,helpful to give a rudi mentary model of propositions and,articulations,that uses some of the tools developed to follow technological,0
latour_1999_pandora_en,latour,articulation,articulation,173,381253,documents the modifications of the in gredients that compose an,articulation,"of entities. Pouchet's spontane ous generation, for instance, at the",0
latour_1999_pandora_en,latour,articulation,articulation,180,400442,phenomena. Sowing germs in a culture medium is the re,articulation,"by Pasteur of what others before him, not understanding what",0
latour_1999_pandora_en,latour,articulation,articulated,191,425518,object (nor their g<:>als) is fixed. When the propositions are,articulated,"they join into a new proposition. They become ""someone, something""",0
latour_1999_pandora_en,latour,articulation,articulation,193,431649,arrival. Not only does this correspond to the notion of,articulation,"I explored in Chapter 5, but it is also consistent",0
latour_1999_pandora_en,latour,articulation,articulation,197,439196,"meaning, but they produce meaning via a special type of",articulation,"that, once again, like the circulating refer ence we met",0
latour_1999_pandora_en,latour,articulation,articulation,197,441063,What would the right word be to account for this,articulation,"I could have said ""objectified"" or ""reified"" or ""real ized""",0
latour_1999_pandora_en,latour,articulation,articulation,198,442420,"because, for the engineers, the speed bump is one meaningful",articulation,within a gamut of proposi tions from which they are,0
latour_1999_pandora_en,latour,articulation,articulation,198,443615,INTERRUPTION Agent i z :MEANING ONE 9 t;: ...-< DETOUR,ARTICULATION,"Agent 2 ------ :MEANING 1WO ., FOURTH :MEANING OF :MEDIATION",0
latour_1999_pandora_en,latour,articulation,articulation,201,451456,policemen become speed bumps. I have earlier called this zone,articulation,"and this is not, as I hope is now clear,",0
latour_1999_pandora_en,latour,articulation,articulation,204,458559,"be folded into humans through the key processes of translation,",articulation,"delegation, shifting out and down. What name can we give",0
latour_1999_pandora_en,latour,articulation,articulate,205,460831,"first, there would be translation*, the means by which we",articulate,"different sorts of matter ; next, what I will call,",0
latour_1999_pandora_en,latour,articulation,articulated,220,498506,"operandi, with some precision. Techniques, we learn from archaeologists, are",articulated,subprograms for actions that subsist (in time) and extend (in,0
latour_1999_pandora_en,latour,articulation,articulated,223,505000,a story in which the further we go the more,articulated,are the collectives we live in (see Figure 6.9). To,0
latour_1999_pandora_en,latour,articulation,articulation,224,506988,pliability ·1 durability y Basic tool kit 2nd Social i,articulation,l complication externalization Techniques 5th Society i domestication reification i,0
latour_1999_pandora_en,latour,articulation,articulation,225,510199,"where we belong in the crossover, the central column, the",articulation,the possibility of mediating between mediators. But my main point,0
latour_1999_pandora_en,latour,articulation,articulation,306,718452,"the hundreds of fragments among which I found delegation, translation*,",articulation,"and the other concepts I've tried to rehabilitate, lying on",0
latour_1999_pandora_en,latour,articulation,articulated,307,720242,in stitutions. We speak truthfully because the world itself is,articulated,not the other way around. That there was once a,0
latour_1999_pandora_en,latour,articulation,articulation,308,722433,nature facing a culture is something entirely different from an,articulation,of humans and nonhumans. If nonhumans are to be assembled,0
latour_1999_pandora_en,latour,articulation,articulation,314,733029,in vain. ANTI-PROGRAMS: See programs of action. APODEIXIS: See epideixis.,ARTICULATION,"Like translation*, this term occupies the position left empty by",0
latour_1999_pandora_en,latour,articulation,articulation,314,733193,and the subject or the external world and the mind.,Articulation,is not a property of human speech but an ontological,0
latour_1999_pandora_en,latour,articulation,articulated,314,733421,"affairs , but only whether or not propositions* are well",articulated,"ASSOCIATION, SUB STITUTION; SYNTAGM, PARA DIGM: These two pairs of",0
latour_1999_pandora_en,latour,articulation,articulation,316,736923,conditions of infelicity. I extend the definition to regimes of,articulation,"such as science, technology, and politics. CONTEXT, CONTENT: Terms borrowed",0
